{
  "$schema": "./schemas/portal-config.schema.json",
  "theme": "portal-default",
  "availableThemes": [
    "01-cosmic-answer",
    "02-learning-portal",
    "03-model-constellation",
    "04-field-signal",
    "05-open-orbit",
    "06-galactic-guide"
  ],
  "galleryUrl": "https://gallery.project-42.dev",
  "layout": {
    "defaultPreset": "standard"
  },
  "portal": {
    "canonicalOrigin": "https://project-42.dev",
    "adminOrigin": "https://admin.project-42.dev",
    "legacyOrigins": [
      "https://learn.project-42.dev"
    ]
  },
  "organization": {
    "name": "Project 42",
    "tagline": "Learn to ask better questions of an expanding universe.",
    "supportUrl": "https://github.com/project42dev/project-42.dev/issues"
  }
}
