{
  "$schema": "./schemas/portal-config.schema.json",
  "theme": "portal-default",
  "availableThemes": [
    "01-cosmic-answer",
    "02-learning-portal",
    "03-model-constellation",
    "04-field-signal",
    "05-open-orbit",
    "06-galactic-guide"
  ],
  "galleryUrl": "https://gallery.example.org",
  "layout": {
    "defaultPreset": "standard"
  },
  "portal": {
    "canonicalOrigin": "https://learn.example.org",
    "adminOrigin": "https://admin.example.org",
    "legacyOrigins": []
  },
  "organization": {
    "name": "Example AI Academy",
    "tagline": "Practical, evidence-based AI learning.",
    "supportUrl": "https://support.example.org"
  },
  "features": {
    "enableFieldGuide": true,
    "enableVisualGuides": true,
    "enableKnowledgeChecks": true,
    "enableBadges": true,
    "enableTranscripts": true
  },
  "content": {
    "upstreamRepo": "https://github.com/project42dev/project42-content.git",
    "upstreamBranch": "main",
    "customContentDir": "./custom-content"
  }
}
